name,address,city,state,zip_code,latitude,longitude,category,description,event_site_url,image_url,is_free,time_start,time_end,attending_count,interested_count,is_canceled,is_official
Voguing with Father DayDay of the House of Juicy,145 Bowery,New York,NY,10002,40.71895689999999,-73.9944117,performing-arts,"Join us for a night of VOGUE with Father DayDay
of the House of Juicy Couture, winner of season
3 of Legendary on HBO max! All levels welcome,
focusing on...",https://www.yelp.com/events/new-york-voguing-with-father-dayday-of-the-house-of-juicy?adjust_creative=vaXd63wEr8RrzPKFIuH35Q&utm_campaign=yelp_api_v3&utm_medium=api_v3_event_search&utm_source=vaXd63wEr8RrzPKFIuH35Q,https://s3-media1.fl.yelpcdn.com/ephoto/nMSK-tSV6AQFtNZzSsLg1Q/o.jpg,False,2024-06-21T17:00:00-04:00,2024-06-21T20:00:00-04:00,1,0,False,False
Shag with Pride: Trans Pleasure Workshop and Social,353 Bedford Ave,Brooklyn,NY,11211,40.7116901,-73.9628766,nightlife,"Come for the workshop, stay for the social. Enjoy drink specials, a pop-
up shop, and a beautiful garden patio perfect for mixing and mingling.
Free for...",https://www.yelp.com/events/brooklyn-shag-with-pride-trans-pleasure-workshop-and-social?adjust_creative=vaXd63wEr8RrzPKFIuH35Q&utm_campaign=yelp_api_v3&utm_medium=api_v3_event_search&utm_source=vaXd63wEr8RrzPKFIuH35Q,https://s3-media3.fl.yelpcdn.com/ephoto/r0LPd-_f5XBVbmKNbJv8dQ/o.jpg,False,2024-06-06T19:00:00-04:00,2024-06-06T21:00:00-04:00,1,0,False,False
Friend of Flame Speed Dating; Queer Edition,353 Bedford Ave,Brooklyn,NY,11211,40.7116901,-73.9628766,nightlife,"Friend or Flame is partnering with Moxy Brooklyn Williamsburg to present to you a night of smoldering conversation, cocktails to quench your thirst, and...",https://www.yelp.com/events/brooklyn-friend-of-flame-speed-dating-queer-edition?adjust_creative=vaXd63wEr8RrzPKFIuH35Q&utm_campaign=yelp_api_v3&utm_medium=api_v3_event_search&utm_source=vaXd63wEr8RrzPKFIuH35Q,https://s3-media2.fl.yelpcdn.com/ephoto/4JTfv12ukMEgdhanwq7_BA/o.jpg,False,2024-06-18T19:00:00-04:00,2024-06-18T22:00:00-04:00,1,0,False,False
Full Moon Rooftop Yoga and Astrology,353 Bedford Ave,Brooklyn,NY,11211,40.7116901,-73.9628766,sports-active-life,"Join us on the rooftop with yoga and sound bowls by
Whitney Berger and a group astrology wind-down with
Samantha Tatiana on this celestial day of the full...",https://www.yelp.com/events/brooklyn-full-moon-rooftop-yoga-and-astrology?adjust_creative=vaXd63wEr8RrzPKFIuH35Q&utm_campaign=yelp_api_v3&utm_medium=api_v3_event_search&utm_source=vaXd63wEr8RrzPKFIuH35Q,https://s3-media4.fl.yelpcdn.com/ephoto/Fb7wDHCdBhjLPQY_EsyVgQ/o.jpg,False,2024-06-21T10:00:00-04:00,2024-06-21T12:30:00-04:00,1,0,False,False
Heat: A Queer Rooftop Experience,353 Bedford Ave,Brooklyn,NY,11211,40.7116901,-73.9628766,nightlife,"The Pride festivities continue with a fun-filled sunset party
hosted by Atomic Annie, Paloma, and Vidana and special
appearance by Daya Betty. Free for...",https://www.yelp.com/events/brooklyn-heat-a-queer-rooftop-experience?adjust_creative=vaXd63wEr8RrzPKFIuH35Q&utm_campaign=yelp_api_v3&utm_medium=api_v3_event_search&utm_source=vaXd63wEr8RrzPKFIuH35Q,https://s3-media2.fl.yelpcdn.com/ephoto/gDDjou22qz8UKNy8jUhCaA/o.jpg,False,2024-06-27T19:00:00-04:00,2024-06-27T22:00:00-04:00,1,0,False,False
